{
  "schema_version": 1,
  "job_id": "job:icml:2026:scrape:001",
  "worker_id": "worker:mac-mini:001",
  "completed_at": "2026-07-13T14:00:00Z",
  "status": "succeeded",
  "result_fingerprint": "bbbbbbbbbbbbbbbbbbbbbbbbbbbbbbbbbbbbbbbbbbbbbbbbbbbbbbbbbbbbbbbb",
  "artifact_ids": ["manifest:icml:2026:001"],
  "error_code": null,
  "error_summary": null,
  "metrics": {
    "duration_seconds": 120.5,
    "paper_count": 100,
    "valid_pdf_count": 100
  }
}
